{
 "$schema": "schemas/caveats-v1.schema.json",
 "id": "decision-model-catalog-caveats",
 "schema_version": 1,
 "generated_at": "2026-10-07",
 "notes": [
  "Nuance registry (56 caveats). Rows cite caveats via caveat_ids[]; a consumer that shows a row must show its caveats. Evidence quotes are verbatim spans from captured source text (JSON snippets are verbatim from the raw files; whitespace in pretty-printed JSON and markdown links may be collapsed). strength: strong = measured or primary-source; moderate = credible but indirect; anecdotal = a single report or comment."
 ],
 "caveats": [
  {
   "id": "latency-hosted-rtt-vs-on-card",
   "statement": "Jev's 524.1 ms median / 536.0 ms p95 is a hosted-API HTTPS round trip from the Index maintainers' lab; open-model figures in the same tables are on-card or in-platform. The 2.5x (Clef) and 13x (Clef-flash) speed ratios compare different quantities.",
   "affects": {
    "models": [
     "jev-1.13.0",
     "clef",
     "clef-flash"
    ],
    "sources": [
     "cloudflare-changelog-clef",
     "jev-decision-index-data",
     "jev-decision-index-methodology",
     "nicia-admission-eval"
    ],
    "metrics": [
     "cf-launch-latency-median-ms",
     "cf-launch-latency-p95-ms",
     "devto-42case-p50-latency-ms",
     "di03-jev-http-median-per-benchmark-ms",
     "di03-jev-http-p95-per-benchmark-ms",
     "di03-jev-http-suite-ms",
     "di03-latency-mean-on-card-ms",
     "di03-latency-median-hosted-rtt-ms",
     "di03-latency-median-on-card-ms",
     "di03-latency-p95-hosted-rtt-ms",
     "di03-latency-p95-on-card-ms",
     "jevbench-v161-capability",
     "jevbench-v161-composite",
     "jevbench-v161-latency-p50-adjusted-ms",
     "jevbench-v161-latency-p50-raw-ms",
     "jevbench-v161-usd-per-decision",
     "morr-latency-p50-hosted-rtt-ms",
     "morr-latency-p50-local-cpu-ms",
     "morr-latency-p50-local-gpu-ms",
     "morr-latency-p95-hosted-rtt-ms",
     "morr-latency-p95-local-cpu-ms",
     "morr-latency-p95-local-gpu-ms",
     "openrouter-p50-latency-ms",
     "td-p50-latency-ms",
     "vc-typesafe-launch-latency-multiple"
    ]
   },
   "strength": "strong",
   "implication": "Never rank 524.1 ms (a hosted round trip) against 209.3 / 38.8 ms (unstated conditions) or against on-card figures. This pack stores latency under separate metric ids per vantage, so a cross-vantage speed ratio is not computable from it.",
   "evidence": [
    {
     "source_id": "jev-decision-index-data",
     "quote": "Hosted API, network round-trip from our lab: one sequential HTTPS client on the latency-v1 sample. Not comparable to the on-card single-process figures."
    },
    {
     "source_id": "jev-decision-index-methodology",
     "quote": "Latency includes HTTPS and concurrent service scheduling; not isolated model inference."
    },
    {
     "source_id": "nicia-admission-eval",
     "quote": "Their leaderboard data notes that the Jev number is a network round trip to the hosted API and the Clef number is measured on the GPU in one process, and that the two are not comparable."
    },
    {
     "source_id": "cloudflare-changelog-clef",
     "quote": "Median 209.3 ms 38.8 ms 524.1 ms"
    },
    {
     "source_id": "cloudflare-changelog-clef",
     "quote": "we achieved speeds where Clef is 2.5x faster than Jev at the median, and Clef-flash 13x faster."
    }
   ]
  },
  {
   "id": "latency-independent-caller-rtt-disagrees",
   "statement": "Caller-side measurements by independent parties do not reproduce the launch speed ordering: Jev is usually the fastest hosted endpoint, hosted Clef is slower than Jev, and absolute Jev numbers range from ~100 ms to ~1.2 s depending on state size, client and day.",
   "affects": {
    "models": [
     "jev-1.13.0",
     "clef",
     "clef-flash",
     "pplx-decider-v1-27b",
     "kev-27b",
     "openai-decisions-gpt-6-luna"
    ],
    "sources": [
     "arxiv-2609-27678-legal",
     "devto-clef-flash-vs-jev",
     "hn-clef-thread",
     "nicia-admission-eval",
     "reddit-jev-embeddings-thread",
     "requesty-benchmark"
    ],
    "metrics": [
     "bonn-mean-latency-ms",
     "legal-nli-median-time-s",
     "rafe-hosted-median-latency-ms",
     "requesty-agnews-p50-latency-ms",
     "requesty-banking77-p50-latency-ms",
     "requesty-emotion-p50-latency-ms",
     "requesty-gateway-item-latency-p50-ms",
     "requesty-gateway-item-latency-p95-ms",
     "requesty-massive-1k-p50-latency-ms",
     "requesty-typed-p50-latency-ms",
     "sdb-latency-p50-hosted-ms",
     "sdb-latency-p50-self-hosted-ms",
     "sdb-latency-p95-hosted-ms",
     "sdb-latency-p95-self-hosted-ms",
     "siujev-latency-p50-ms",
     "siujev-latency-p95-ms",
     "td-p50-latency-ms"
    ]
   },
   "strength": "strong",
   "implication": "For a hot-path choice, measure from your own region with your own state size and concurrency. Treat any single published ms as a (publisher, place, protocol, day) tuple. Hosted Clef from a laptop/US-west was 4-7x slower than hosted Jev in the only head-to-head with raw numbers.",
   "evidence": [
    {
     "source_id": "nicia-admission-eval",
     "quote": "Jev 1.13.0 | 98–167 ms / 156–260 ms"
    },
    {
     "source_id": "nicia-admission-eval",
     "quote": "Clef-flash | 429–533 ms / 677–732 ms"
    },
    {
     "source_id": "nicia-admission-eval",
     "quote": "Clef | 638–717 ms / 0.9–1.1 s"
    },
    {
     "source_id": "nicia-admission-eval",
     "quote": "Clef's latency runs opposite to the launch claim."
    },
    {
     "source_id": "devto-clef-flash-vs-jev",
     "quote": "Latency: Jev p50 225ms over the network. Clef-Flash p50 315ms fully local, single 3090, no batching."
    },
    {
     "source_id": "requesty-benchmark",
     "quote": "Perplexity is the fastest at about 385 ms regardless of dataset. Sference Clef is 407 to 566 ms, Cloudflare Clef 626 to 780 ms. These are deployment numbers for one client location on one day, not model properties: the same weights are 200 ms apart depending on who serves them."
    },
    {
     "source_id": "arxiv-2609-27678-legal",
     "quote": "Jev also has the lowest observed median baseline response time: 1.24 seconds, compared with 1.60 for Flash-Lite and 1.74 for Luna."
    },
    {
     "source_id": "hn-clef-thread",
     "quote": "Clef was 2-3x slower and worse"
    },
    {
     "source_id": "hn-clef-thread",
     "quote": "it caught less hate speech) than Jev."
    },
    {
     "source_id": "hn-clef-thread",
     "quote": "it ended up being significantly slower and the results were worse."
    },
    {
     "source_id": "reddit-jev-embeddings-thread",
     "quote": "Up to about 50 questions against state of 4k or less, the timing was identical to one question (around 120ms per request)"
    }
   ]
  },
  {
   "id": "latency-measurement-protocol-drift",
   "statement": "The Index's latency protocol changed: current board medians come from latency-v1 (one sequential client, one RTX PRO 6000, 750 timed rows), and earlier figures from scoring runs (some with 6-12 processes sharing a card) were withdrawn. Today's Index lists Clef 102.1 ms and Clef-flash 53.4 ms, versus 209.3 / 38.8 ms in Cloudflare's launch table; it is not stated which protocol Cloudflare's numbers used.",
   "affects": {
    "models": [
     "clef",
     "clef-flash"
    ],
    "sources": [
     "cloudflare-blog-clef",
     "jev-decision-index-methodology",
     "jev-decision-index-data"
    ],
    "metrics": [
     "cf-launch-latency-median-ms",
     "cf-launch-latency-p95-ms",
     "di03-jev-http-median-per-benchmark-ms",
     "di03-jev-http-p95-per-benchmark-ms",
     "di03-jev-http-suite-ms",
     "di03-latency-mean-on-card-ms",
     "di03-latency-median-hosted-rtt-ms",
     "di03-latency-median-on-card-ms",
     "di03-latency-p95-hosted-rtt-ms",
     "di03-latency-p95-on-card-ms"
    ]
   },
   "strength": "moderate",
   "implication": "Pin latency to a protocol id (latency-v1) and edition. Do not mix Cloudflare-table latencies with Index-v0.3 latencies. Flag p95 as missing for Index rows.",
   "evidence": [
    {
     "source_id": "jev-decision-index-methodology",
     "quote": "Earlier board figures came from the scoring runs, some timed with 6 to 12 processes sharing a card or with queue waits removed; they are no longer shown."
    },
    {
     "source_id": "cloudflare-blog-clef",
     "quote": "Median latency · ms 209.3 38.8 524.1 84.4 51.4 5.8"
    },
    {
     "source_id": "jev-decision-index-data",
     "quote": "\"v03\":{\"engine\":\"clef\",\"pub\":61.71,\"same_skills\":53.11,\"new_domains\":41.88,\"v\":53.08,\"lab\":false,\"jev\":false,\"rank_v\":19,\"rank_pub\":3",
     "location": "index.json models[engine=clef].v03 (compact JSON)"
    }
   ]
  },
  {
   "id": "latency-scales-with-state-size-and-question-count",
   "statement": "Latency depends on total tokens. Hosted Jev is nearly flat to ~50 questions at <=4k state then grows roughly linearly; self-hosted open models are prefill-bound (about 0.2 s for tiny states, 2.5-3 s at ~700 tokens on a busy CPU); median-only launch numbers hide the curve.",
   "affects": {
    "models": [
     "jev-1.13.0",
     "clef",
     "decider-2b",
     "decider-4b"
    ],
    "sources": [
     "hn-clef-thread",
     "reddit-jev-embeddings-thread",
     "divan-decider-2b-cpu"
    ],
    "metrics": [
     "local-decider-latency-median-ms",
     "local-decider-latency-server-ms",
     "reddit-jev-fanout-latency-ratio"
    ]
   },
   "strength": "moderate",
   "implication": "Compare latency only at the same input size and question count; a median alone is one point on a curve. Short-state routing favours small local models; long-state or many-question workloads favour hosted Jev's flat curve (to dozens of questions).",
   "evidence": [
    {
     "source_id": "reddit-jev-embeddings-thread",
     "quote": "Latency increases linearly past that with total number of tokens"
    },
    {
     "source_id": "reddit-jev-embeddings-thread",